category,question,answer 
Sports_History,When did Jordan first participate in the Olympics?,"Jordan first participated in the Moscow 1980 Olympics."
Sports_History,Which Arab Games did Jordan host?,"Jordan hosted the 1999 Pan Arab Games (Al-Hussein Games), which was a massive event."
Sports_Adventure,What is the Jordan Trail?,"It is a long-distance hiking trail stretching from Um Qais in the north to Aqaba in the south, passing through Jordan's diverse landscapes."
Sports_Culture,How do Jordanians celebrate a win?,"Car convoys fill the streets, flags are waved, and patriotic songs like 'Ya Bayraqna Al-Ali' are played loudly."
Category,Question,Answer
Tourism_Amman,Best walking areas in Amman?,"Rainbow Street, The Boulevard (Abdali), and the old Downtown (Al-Balad)."
Tourism_Amman,What is in the Royal Automobile Museum?,"It houses a rare collection of cars owned by the Kings of Jordan since the founding of the Emirate, telling Jordan's history through cars."
Tourism_Amman,What is the Roman Theatre in Amman?,"An ancient theatre located downtown, seating 6,000 spectators, used for celebrations in the Roman era."
Tourism_Amman,Where is the Jordan Museum?,"Located in Ras Al-Ain, it is the largest museum in Jordan, housing the Dead Sea Scrolls and Ain Ghazal statues."
Tourism_Amman,What is the Citadel (Jabal Al-Qala'a)?,"The highest hill in ancient Amman, featuring the Temple of Hercules, the Umayyad Palace, and the Archaeological Museum, offering panoramic views."
Tourism_Amman,What is Qasr Al-Abd?,"A rare Hellenistic pal23333333`ace located in Iraq Al-Amir, west of Amman."
Tourism_Amman,Where can I find the best Knafeh in Amman?,"Downtown is famous for historic Knafeh shops like Habibah, a must-try experience for any visitor."
Tourism_Amman,What is Souk Jara?,"A seasonal market for handicrafts and arts held on Rainbow Street every Friday during the summer."
Tourism_Amman,What is the Weibdeh area?,"A cultural hill in Amman known for quiet cafes, art centers (like Darat Al Funun), and street murals."
Tourism_Amman,What is King Abdullah I Mosque?,"Known as the Blue Mosque, located in Abdali, famous for its blue mosaic dome and open to tourists."
Tourism_Jerash,When is the Jerash Festival held?,"Usually held in summer (July or August), lasting several days featuring international music and cultural performances."
Tourism_Jerash,What is Hadrian's Arch?,"A massive gateway at the entrance of ancient Jerash, built to honor Emperor Hadrian's visit."
Tourism_Jerash,What is the Oval Plaza in Jerash?,"A unique oval-shaped plaza surrounded by columns, considered the icon of the ancient city."
Tourism_Jerash,How far is Jerash from Amman?,"It is about 48 km north of Amman, taking approximately 45 minutes by car."
Tourism_Jerash,Are there restaurants in Jerash?,"Yes, inside the site there is the Lebanese House and Artemis Restaurant, plus many rest stops along the road."
Tourism_Ajloun,What is Ajloun Castle?,"An Islamic fortress built by Izz al-Din Usama (one of Saladin's generals) in 1184 AD to defend against Crusaders."
Tourism_Ajloun,What is Ajloun Forest Reserve?,"A nature reserve famous for dense oak forests, offering wooden cabins for overnight stays in nature."
Tourism_Ajloun,What is the Ajloun Cable Car (Teleferique)?,"A new tourism project taking you on an aerial journey over Ajloun forests up to the castle area."
Tourism_Ajloun,What is the Rasoun Trail?,"A hiking trail in Ajloun villages passing through valleys, springs, and ancient ruins."
Tourism_Ajloun,Soap making in Ajloun?,"Ajloun is famous for the Soap House in the reserve, where soap is handmade from olive oil and natural herbs."
Tourism_Irbid,What is Umm Qais?,"An ancient city (Gadara) in the north, famous for its black basalt ruins and enchanting views of the Sea of Galilee."
Tourism_Irbid,What is Dar Al-Saraya Museum?,"Located in downtown Irbid, it was an Ottoman fortress and prison before becoming a history museum."
Tourism_Irbid,What is Pella (Tabaqat Fahl)?,"An archaeological site in the Northern Jordan Valley, known for Roman ruins and green nature in spring."
Tourism_Irbid,Where is Wadi Al-Rayan?,"Located in the Koura district of Irbid, featuring waterfalls, old mills, and pomegranate trees."
Tourism_Irbid,What is Irbid famous for?,"Known as the 'Bride of the North', famous for fertile soil, universities (Yarmouk & JUST), and the 'Makmoura' dish."
Tourism_Salt,What is Hammam Street in Salt?,"A heritage street in downtown Salt, famous for spice shops, traditional markets, and yellow stone architecture."
Tourism_Salt,Why is Salt on the UNESCO Heritage list?,"Due to its unique architecture and the social welfare system (Madafa) representing coexistence."
Tourism_Salt,What is the Historic Old Salt Museum (Abu Jaber House)?,"A heritage mansion turned into a museum displaying Salt's commercial and social history in the late Ottoman era."
Tourism_Salt,What is Al-Sitteen View?,"A street in the highlands of Salt offering a breathtaking panoramic view of the West Bank and Palestine mountains."
Tourism_Salt,What is Al-Khader Church?,"A historic church in Salt visited by both Muslims and Christians for blessings, symbolizing religious coexistence."
Tourism_Madaba,What is Madaba famous for?,"Nicknamed the City of Mosaics, it holds the largest number of Byzantine mosaic floors in the world."
Tourism_Madaba,What is the Madaba Map?,"The``````````` oldest surviving mosaic map of the Holy Land, located on the floor of St. George's Church."
Tourism_Madaba,What is Mount Nebo?,"The site where Prophet Moses saw the Promised Land and died, featuring an ancient church and Dead Sea views."
Tourism_Madaba,What is Mukawir Castle?,"A historic hilltop fortress overlooking the Dead Sea, where it is believed John the Baptist was imprisoned and beheaded."
Tourism_Madaba,What is Wadi Hidan?,"A water adventure canyon near Madaba, considered one of the most beautiful trekking spots in Jordan."
Tourism_DeadSea,What is the Dead Sea Panorama?,"A museum and restaurant on a cliff edge overlooking the Dead Sea, offering the best sunset view."
Tourism_DeadSea,Are there hotels at the Dead Sea?,"Yes, there is an are444444444a of world-class 5-star hotels offering private beaches and mud/salt treatments."
Tourism_DeadSea,What are Ma'in Hot Springs?,"Natural thermal waterfalls located near the Dead Sea, used for relaxation and therapeutic treatment."
Tourism_DeadSea,What is Amman Tourist Beach?,"A public beach equipped with pools and facilities, offering entry at a reasonable price compared to hotels."
Tourism_DeadSea,What is Samarah Mall?,"A shopping center and promenade with restaurants and cafes overlooking the Dead Sea."
Tourism_Karak,What is Karak Castle?,"One of the largest Crusader castles in the region, featuring secret passageways and huge underground halls."
Tourism_Karak,What is the Shrine of Prophet Noah?,"A tomb attributed to Prophet Noah located in Karak city, a religious visitation site."
Tourism_Karak,What is Karak famous for (Food)?,"It is `````````````````the capital of 'Karaki Jameed', considered the best for making Jordan's Mansaf."
Tourism_Karak,What is Wadi Bin Hammad?,"A magical tropical valley in Karak featuring flowing water, palm trees, and hanging gardens."
Tourism_Tafilah,What is Dana Heritage Village?,"An ancient stone village on the edge of the valley, restored as a tourism hub and eco-lodge."
Tourism_Tafilah,What is Feynan Ecolodge?,"A solar-powered eco-lodge lit by candles at night, located deep in Wadi Araba."
Tourism_Tafilah,What is Shobak Castle?,"A Crusader castle (Montreal) on an isolated hill, famous for its water wells and long secret tunnel."
Tourism_Tafilah,What are Afra Hot Springs?,"Thermal mineral springs in Tafilah visited by people for healing and therapy."
Touris%%%%%%%%%m_Ma'an,Where is Little Petra?,"Located in Al-Beidha (near Petra), a smaller Nabataean site that served as a caravan station."
Tourism_Ma'an,How much is the Petra ticket?,"For non-Jordanians 50 JOD (one day), and for Jordanians 1 JOD."
Tourism_Ma'an,What is the Monastery (Ad Deir) in Petra?,"The largest monument in Petra, requiring a climb of 800 steps, offering stunning views."
Tourism_Ma'an,What is the High Place of Sacrifice?,"A religious site atop a mountain in Petra used by Nabataeans for sacrifices, offering a view of the whole city."
Tourism_Wadi_Rum,What are Jeep Tours in Wadi Rum?,"Tours in 4x4 pickup trucks driven by local Bedouins to explore the desert and rock bridges."
Tourism_Wadi_Rum,What are Bubble Tents?,"Transparent spherical tents in Wadi Rum allowing you to sleep under the stars with hotel-grade comfort."
Tourism_Wadi_Rum,What is Burdah Rock Bridge?,"The highest natural rock bridge in Wadi Rum, requiring a climb to reach, a challenge for adventurers."
Tourism_Wadi_Rum,What is the Great Arab Revolt Train?,"A historic train tourists can ride to reenact the 1916 attack scene."
Tourism_Wadi_Rum,Where were Hollywood movies filmed?,"Mostly in Wadi Rum, including Lawrence of Arabia, The Martian, Star Wars, and Aladdin."
Tourism_Aqaba,What is Aqaba Castle?,"A Mamluk fortress near the beach that played a role in the Great Arab Revolt victory."
Tourism_Aqaba,What is the South Beach?,"The best beach for swimming and diving in Aqaba, home to the Marine Park and coral reefs."
Tourism_Aqaba,What is Saraya Aqaba?,"A massive tourism project featuring a man-made lagoon, hotels, malls, and a water park."
Tou\\\\\\\\\rism_Aqaba,What is Sayadieh?,"Aqaba's signature dish, consisting of rice, fresh fish, and special spices."
Tourism_Aqaba,Is there an airport in Aqaba?,"Yes, King Hussein International Airport, receiving low-cost international flights."
Tourism_Azraq,What is Azraq Castle?,"A black basalt desert fortress used by Lawrence of Arabia as his headquarters during winter."
Tourism_Azraq,What is Azraq Wetland Reserve?,"A rare water oasis in the eastern desert, a resting station for migratory birds."
Tourism_Eastern_Desert,What are the Desert Castles?,"A group of Umayyad palaces in the eastern badia, most notably Qasr Al-Kharana and Qasr Amra."
Tourism_Eastern_Desert,What is special about Qasr Amra?,"Famous for its rare frescoes depicting hunting and rulers, it is a UNESCO World Heritage Site."
Tourism_Eastern_Desert,What is the Buqayawiya Tree?,"An ancient pistachio tree in the eastern desert where Prophet Muhammad is believed to have rested."
Adventure_Tourism,What is the Jordan Trail?,"A long-distance hiking trail (650 km) crossing Jordan from Um Qais to Aqaba, taking ~40 days."
Adventure_Tourism,What is Wadi Hasa?,"The longest water valley in Jordan, perfect for river trekking and canyoning."
Adventure_Tourism,What is Abseiling?,"The sport of descending cliffs or waterfalls using ropes, popular in Wadi Mujib."
Adventure_Tourism,Where can I go horse riding?,"In Petra, equestrian clubs in Amman, and private stables in Madaba."
Medical_Tourism,Why do tourists come for treatment in Jordan?,"For world-class doctors and hospitals at competitive prices, especially for heart, infertility, and eye treatments."
Medical_Tourism,Benefits of Dead Sea mud?,"It treats skin diseases like psoriasis and eczema, and relieves joint pain and rheumatism."
Religious_To$$$urism,What are the Shrines of Companions?,"Religious sites in the Jordan Valley and Karak housing tombs of Mut'ah battle leaders (Ja'far, Zaid, Abdullah)."
Religious_Tourism,What is the Cave of the Seven Sleepers?,", Amman, believed to be the cave mentioned in the Quran (Surah Al-Kahf)."
Religious_Tourism,What is Prophet Shoaib's Shrine?,"Located in Wadi Shoaib near Salt, a religious site overlooking beautiful landscapes."
Religious_Touri1111111sm,What is Mount Aaron (Jabal Haroun)?,"A high peak in Petra topped by a white shrine attributed to Prophet Aaron (Moses' brother)."
Logistics,Best time to visit Jordan?,"Spring (March-May) and Autumn (Sept-Nov) when the weather is mild and suitable for all activities."
Logistics,Do I need a visa for Jordan?,"Most nationalities need a visa, purchasable upon arrival or included in the Jordan Pass."
Logistics,How to use the internet?,"You can buy a tourist SIM card (Zain, Orange, Umniah) at the airport for cheap prices and great coverage."
Logistics,Is tap water drinkable?,"It is not recommended to drink tap water directly; bottled water is preferred and available everywhere."
Logistics,What is acceptable swimwear?,"Bikinis are fine in hotels/private beaches. In public beaches/wadis, modest wear (t-shirt & shorts) is preferred."
Logistics,Is tipping mandatory?,"Not mandatory but expected/appreciated. Usually 10% in restaurants, and small amounts for drivers/guides."
Logistics,What is the Airport Bus?,"Shuttle buses transporting travelers from Queen Alia Airport to North Station (Tabarbour) in Amman and vice versa."
Logistics,Do delivery apps work in Jordan?,"Yes, apps like Uber, Careem, and Jeeny work efficiently in Amman and major cities."
Logistics,What is the electricity voltage?,"Voltage is 220V, and sockets are usually two-pin (European) or three-pin (British)."
Logistics,Where to exchange money?,"Exchange shops in Downtown and Malls offer better rates than hotels and the airport."
Food_Tourism,What is Jordanian Falafel?,"Fried patties of ground chickpeas, the #1 popular breakfast. A falafel sandwich is cheap and delicious."
Food_Tourism,What is Zeit w Zaatar?,"Traditional breakfast of bread dipped in olive oil then thyme/sesame mix, very famous in the Levant."
Food_Tourism,12What is4444444 Galayet Bandora?,"A heritag4wttwe skillet dish made of tomatoes, garlic, hot peppers, and olive oil, eaten with bread."
Food_Tourism,Where to try street food?,"Rainbow Street, Downtown Amman, and University Street in Irbid are full of food stalls."
Shopping,What to buy downtown?,"Spices, sweets, oriental antiques, and traditional costumes."
Shopping,Are there big malls in Amman?,"Yes, City Mall, Taj Mall, Abdali Mall, and Mecca Mall feature global brands and cinemas."
Traditions,How to greet people in Jordan?,"Common greetings are 'As-salamu alaykum' or 'Marhaba', with a handshake."
Traditions,Is smoking allowed?,"Smoking and Shisha are very common, but prohibited in government buildings and hospitals."
Eco_Tourism,What is Feynan Ecolodge?,"A lodge in Wadi Araba, ranked among the best eco-lodges globally, perfect for stargazing."
Eco_Tourism,What is Jordan Hiking?,"Groups that organize weekly hiking trips to explore nature and valleys."
Trivia,What is the lowest point on Earth?,"The shores of the Dead Sea in Jordan are the lowest point on dry land."
Category,Question,Answer
Jordan_History,When was Jordan's Independence Day?,"Jordan gained full independence on May 25, 1946, which is the Kingdom's National Day."
Jordan_History,Who is the founding King of Jordan?,"King Abdullah I bin Al-Hussein is the founder of the Emirate of Transjordan and the Kingdom."
Jordan_History,Who wrote the Jordanian Constitution?,"King Talal bin Abdullah established the modern Jordanian Constitution in 1952, considered one of the most progressive."
Jordan_History,When was the Arabization of the Army command?,"King Hussein bin Talal Arabized the army command and dismissed Glubb Pasha on March 1, 1956."
Jordan_History,What is the Battle of Karameh?,"A battle in 1968 where the Jordanian Army defeated Israeli forces, shattering the myth of the invincible army."
Jordan_History,What is the Great Arab Revolt?,"A revolution launched in 1916 led by Sharif Hussein bin Ali against Ottoman rule, marking the foundation of the modern Jordanian state."
Jordan_History,What does the seven-pointed star in the flag mean?,"It symbolizes the seven verses of Al-Fatiha in the Quran, and the unity of Arab goals."
Jordan_History,What are the c1111111111olors of the Jordanian flag?,"Black (Abbasids), White (Umayyads), Green (Fatimids), and Red (Hashemites)."
Jordan_History,When did King Abdullah II ascend the throne?,"His Majesty King Abdullah II assumed his constitutional powers on February 7, 1999."
Jordan_History,Who is the current Crown Prince of Jordan?,"His Royal Highness Crown Prince Al-Hussein bin Abdullah II."
Jordan_Symbols,What is the national flower of Jordan?,"The Black Iris, a rare flower that blooms in spring."
Jordan_Symbols,What is the national bird of Jordan?,"The Sinai Rosefinch, which is frequently found in Petra."
Jordan_Symbols,What is the official Coat of Arms?,"The Royal Hashemite Crown symbolizes the monarchy, and the red sash symbolizes sacrifice and purity."
Jordan_Nature,What is Shaumari Reserve?,"Jordan's first nature reserve, established to protect the Arabian Oryx from extinction."
Jordan_Nature,What is Azraq Wetland Reserve?,"A water oasis in the eastern desert serving as a vital stopover for migratory birds between Africa and Europe."
Jordan_Nature,What is King Talal Dam?,"The largest dam in Jordan located in Jerash, used for rainwater storage and irrigation."
Jordan_Nature,What is Wadi Hidan?,"A magical water canyon in Madaba featuring black basalt rocks and flowing water, a favorite for adventurers."
Jordan_Nature,What are Bergesh Forests?,"Dense forests located in Al-Koura (Irbid), famous for their oak trees and Al-Dhaher Cave."
Jordan_Nature,Where are hot springs other than Ma'in?,"There are North Shuna hot springs and Al-Himma hot springs in the Yarmouk Valley."
Jordan_Nature,What endangered animal lives in Dana?,"The Caracal (desert lynx) and the Nubian Ibex live in the rocky slopes of Dana."
Jordan_Archeology,What are the Ain Ghaz!!!!!!!al statues?,"The oldest plaster human statues discovered in the world, dating back to the Neolithic period (8000 BC), displayed in the Jordan Museum."
Jordan_Archeology,What is the Mesha Stele?,"An ancient stone where Moabite King Mesha inscribed his victories. It is the most important written document in the region's history."
Jordan_Archeology,What is Umm el-Jimal?,"Nicknamed 'The Black Oasis', a Nabataean-Byzantine city in Mafraq built entirely of black volcanic basalt."
Jordan_Archeology,What is Qasr Al-Kharana?,"An Umayyad desert castle unique for being built solely for defense purposes, containing no mosaics."
Jordan_Archeology,What is Qasr Al-Mushatta?,"An Umayyad palace near the airport. Its famous ornate facade was moved to the Pergamon Museum in Berlin."
Jordan_Archeology,What is Iraq Al-Amir?,"An area west of Amman containing Qasr Al-Abd and ancient caves, famous for its natural beauty."
Jordan_Archeology,What are the ruins of Pella (Tabaqat Fahl)?,"One of the Decapolis cities, known for being continuously inhabited from the Stone Age until today."
Jordan_Archeology,What is the Map Church?,"St. George's Church in Madaba, which contains the oldest mosaic map of the Holy Land."
Jordan_Archeology,What is the Nymphaeum?,"A Roman public fountain in downtown Amman used for water distribution and city decoration."
Jordan_Archeology,What is Shobak Castle (Montreal)?,"A Crusader castle built in a remote area, famous for a secret water tunnel descending deep into the mountain."
Jordan_Culture,What is Jordanian Dabke?,"A collective folk dance expressing joy and unity, performed at weddings and national events."
Jordan_Culture,What is Al-Mehbash?,"A wooden tool for grinding coffee manually. The rhythmic sound of grinding is a symbol of hospitality and inviting guests."
Jordan_Culture,What is the Rababa?,"An ancient Bedouin single-string musical instrument used to accompany Nabati poetry."
Jordan_Culture,What is the Jordanian Thob (Madruga)?,"The traditional dress for Jordanian women, with embroidery and colors varying by region (Salt, Karak, Ma'an)."
Jord!!!!!!@@an_Culture,What is the Jordanian Shemagh?,"The traditional red and white headscarf for men, symbolizing national identity and the Arab Army."
Jordan_Culture,What is 'Jaha'?,"A tribal custom for proposing marriage, where dignitaries from the groom's family officially ask for the bride's hand."
Jordan_Culture,What is 'Atwa'?,"A tribal security truce granted between conflicting parties until a problem is solved, part of tribal law."
Jordan_Culture,What is Bayt Al-Sha'er?,"The traditional Bedouin tent made of black goat hair, known for being water and heat resistant."
Jordan_Culture,What is Al-Samer?,"A Bedouin singing and dancing art performed by men in a row, relying on clapping and improvised poetry."
Jordan_Cultu#######re,Who is Arar?,"Mustafa Wahbi Al-Tal, Jordan's foremost poet, who praised the homeland's soil and the poor."
Jordan_Economy,What are Jordan's main natural resources?,"Phosphate, Potash (from the Dead Sea), and Oil Shale."
Jordan_Economy,What is the Jordanian Dinar pegged to?,"The JOD is pegged to the US Dollar at a fixed rate (1 JOD = 1.41 USD) since 1995."
Jordan_Economy,What is the Arab Potash Company?,"One of the world's largest producers of potash, with factories located at the Dead Sea."
Jordan_Economy,What is Aqaba Port?,"Jordan's only maritime outlet, handling the majority of the Kingdom's imports and exports."
Jordan_Economy,What is the Abdali Project?,"A massive real estate development in Amman, considered the 'New Downtown' of the capital."
Jordan_Economy,Medical Tourism in economy?,"Jordan is the #1 destination in the Middle East for medical tourism, generating significant revenue."
Jordan_Economy,What is King Hussein Business Park?,"A high-tech business complex in Amman hosting major global companies and startups."
Jordan_Economy,What is Oil Shale?,"Jordan possesses huge reserves of oil shale and gas, particularly in the Risha area."
Jordan_Economy,What is Royal Jordanian?,"The national flag carrier airline, established in 1963, nicknamed 'The Flying Ambassador of Jordan'."
Jordan_Food_More,What is Rashouf?,"A popular winter dish made of wheat groats, lentils, and Jameed, eaten hot."
Jordan_Food_More,What are Lazagiyat?,"A traditional dessert consisting of thin bread baked on a Saj, covered with ghee and sugar/honey."
Jordan_Food_More,What are Ca'akeel?,"A popular dish in northern Jordan consisting of dough balls cooked in yogurt or lentil soup."
Jordan_Food_More,What is Jordanian Harissa?,"A popular sweet made of semolina, ghee, and syrup, garnished with almonds, famous in downtown Amman."
Jordan_Food_More,What are Warbat?,"A famous Ramadan dessert consisting of pastry layers filled with fresh cream and syrup."
Jordan_Food_More,What is Tamarind drink?,"A popular drink sold by street vendors in traditional attire in old Amman streets."
Jordan_Food_More,What is Sajiyeh?,"A method of cooking meat in a large wok (Saj) over firewood, essential for outdoor picnics."
Jordan_Food_More,What is Jameed?,"Dried, salted goat yogurt in the form of stone-hard balls, the key ingredient for Mansaf."
Jordan_Food_More,What is Baladi Ghee?,"Animal fat made at home, added to food and sweets for a rich, distinctive flavor."
Jordan_Food_More,What is Baladi Za'atar?,"An essential breakfast mix of dried thyme, sesame, and sumac, eaten with olive oil."
Jordan_Cities,What is Fuheis famous for?,"A predominantly Christian city famous for the Fuheis Festival and Christmas celebrations."
Jordan_Cities,What is Mafraq famous for?,"It is the international transport hub connecting Jordan with Iraq and Syria, housing King Hussein Air Base."
Jordan_Cities,What is Ramtha famous for?,"Its border location, folk poetry, cross-border trade, and traditional wedding songs."
Jordan_Cities,What is the Jordan Valley (Ghor)?,"A low, warm area (Jordan's food basket) producing vegetables and fruits (especially bananas) year-round."
Jordan_Cities,What is Sahab?,"An industrial city east of Amman, housing the largest industrial estate and Islamic cemetery."
Jordan_Cities,What is Baqa'a Camp?,"The largest Palestinian refugee camp in Jordan, known for its very active commercial market."
Jordan_Cities,Where is Mutah University?,"Located in Karak Governorate, it has both a military wing and a civilian wing."
Jordan_Cities,What is Umm Qais?,"A city in the far north overlooking three countries (Jordan, Syria, Palestine) and the Sea of Galilee."
Jordan_Cities,What is the Downtown Souq (Hasba)?,"The oldest and largest market for fresh fruit and vegetables in downtown Amman."
Jordan_Cities,What is Wakalat Street?,"A pedestrian-only street in the Sweifieh area of Amman, featuring global brands."
Religious_Sites,What is Prophet Ayub Shrine?,"A religious shrine located in Salt, visited for blessings and prayer."
Religious_Sites,What is Prophet Yosha Shrine?,"Located in Salt on a high hill overlooking the Jordan Valley and Palestine."
Religious_Sites,Where is the Buqayawiya Tree?,"In the eastern desert; it is believed Prophet Muhammad rested under it during his journey to the Levant."
Religious_Sites,Who are the Mutah Companions?,"Shrines in Al-Mazar Al-Janoubi for the leaders of the Battle of Mutah: Ja'far, Abdullah, and Zaid."
Religious_Sites,What is Lady of the Mountain Church?,"A church in Anjara (Ajloun) recognized by the Vatican as a Christian pilgrimage site."
Religious_Sites,What is Mount Nebo religiously?,"Where Prophet Moses stood and saw the Holy Land; believed to be his burial place."
Religious_Sites,Where is the Cave of Jesus?,"In Iraq Al-Amir, it is believed Jesus Christ sought refuge there."
Religious_Sites,What is Al-Husseini Mosque?,"The oldest mosque in downtown Amman, built on the ruins of an ancient Umayyad mosque."
Religious_Sites,What is King Hussein Mosque?,"Currently the largest mosque in Jordan, located in Dabouq, known for its grandeur and high location."
Religious_Sites,What is the Byzantine Church in Petra?,"An ancient church discovered in Petra featuring amazingly preserved mosaic floors."
Modern_Life,What is Arbor Day?,"A national day on January 15th dedicated to planting trees across the Kingdom."
Modern_Life,What is the Global Village in Amman?,"A summer festival that used to showcase cultures and products from around the world."
